A1: Teacher:gnesdilow, Date:20070208
A3: Unit | B3: Topic | C3: Concept | D3: DL-link | E3: count
A4: Forces and Motion | B4: Circular motion | C4: acceleration | D4: Acceleration in Circular Motion | E4: 0.33300000000000002
D5: Basics of Centripetal Acceleration | E5: 0.33300000000000002
D6: Expression for Centripetal acceleration and force | E6: 0.33300000000000002
A7: Forces and Motion | B7: Circular motion | C7: energy | D7: Variation of Energy of an object in Circular Motio | E7: 1.000
A8: Forces and Motion | B8: Circular motion | C8: force | D8: Centripetal Force in a rollercoaste | E8: 0.250
D9: Centripetal Force in various situation | E9: 0.250
D10: Centripetal Force and its direction | E10: 0.125
D11: Motion Characteristics for Circular Motion | E11: 0.125
D12: Car Motion and Centripetal force | E12: 0.125
D13: Expression of centripetal force | E13: 0.125
A14: Forces and Motion | B14: Circular motion | C14: gravity | D14: Gravity and Centripetal Forc | E14: 0.500
D15: Weightlessness | E15: 0.500
A16: Forces and Motion | B16: Circular motion | C16: kinetic energy | D16: Variation of Kinetic Energy of an object in Circular Motio | E16: 1.000
A17: Forces and Motion | B17: Circular motion | C17: Newtons 1st law | D17: Inertia of a bod | E17: =2/6 -> 0.33333333333333331
D18: Newtons First Law with Example | E18: =1/6 -> 0.16666666666666666
D19: Newtons First law explaine | E19: =1/6 -> 0.16666666666666666
D20: Animation: Why are seat belts necessary | E20: =1/6 -> 0.16666666666666666
D21: Animation: Law of Inertia in the real world | E21: =1/6 -> 0.16666666666666666
A22: Forces and Motion | B22: Circular motion | C22: Newtons 2nd law | D22: F=ma relationship explaine | E22: 0.250
D23: Newtons Second Law Explained | E23: 0.250
D24: Statement of Newtons Second la | E24: 0.250
D25: Newtons Second Law in rocket | E25: 0.250
A26: Forces and Motion | B26: Circular motion | C26: Newtons 3rd law | D26: Newtons Third La | E26: 0.250
D27: Action Reaction Forces and Forces in Equilibriu | E27: 0.250
D28: Newtons Third Law in Natur | E28: 0.250
D29: Identify Action-Reaction pairs of forces | E29: 0.250
A30: Forces and Motion | B30: Circular motion | C30: Newtons laws | D30: A brief introduction to the Newtons Laws of Motio | E30: 0.500
D31: Importance of Newtons Law | E31: 0.500
A32: Forces and Motion | B32: Circular motion | C32: potential energy | D32: Variation of Potential Energy of an object in Circular Motio | E32: 1.000
A33: Forces and Motion | B33: Circular motion | C33: Speed | D33: Speed in Circular Motio | E33: 1.000
A34: Forces and Motion | B34: Circular motion | C34: Velocity | D34: How is velocity in circular motion not constant? | E34: 0.500
D35: Velocity in Circular Motio | E35: 0.500
A36: Forces and Motion | B36: Falling objects | C36: acceleration | D36: Calculation of Velocity and Distance traveled using 'g | E36: =2/7 -> 0.2857142857142857
D37: Interactive Activity: Free Fall Simulatio | E37: =2/7 -> 0.2857142857142857
D38: Acceleration during Free Fall: Ideal Condition | E38: =1/7 -> 0.14285714285714285
D39: Acceleration during Free Fall: Real worl | E39: =1/7 -> 0.14285714285714285
D40: The Acceleration due to Gravity ( | E40: =1/7 -> 0.14285714285714285
A41: Forces and Motion | B41: Falling objects | C41: drag | D41: Effect of Surface Area and speed on the motion of free falling objects | E41: =2/7 -> 0.2857142857142857
D42: Motion of a falling objects when drag is presen | E42: =1/7 -> 0.14285714285714285
D43: Free Fall and Air Resistance | E43: =1/7 -> 0.14285714285714285
D44: Free fall of an elephant and a feather | E44: =1/7 -> 0.14285714285714285
D45: Factors affecting Drag | E45: =1/7 -> 0.14285714285714285
D46: Kinds of Drag | E46: =1/7 -> 0.14285714285714285
A47: Forces and Motion | B47: Falling objects | C47: energy | D47: Conservation of Energy in falling objects | E47: 0.250
D48: Conversion of Energy in falling objects | E48: 0.250
D49: Gravitational Potential Energy | E49: 0.250
D50: Interactive Activity: Energy in falling objects | E50: 0.250
A51: Forces and Motion | B51: Falling objects | C51: force | D51: Gravity and | E51: =2/3 -> 0.66666666666666663
D52: Lift and Drag | E52: =1/3 -> 0.33333333333333331
A53: Forces and Motion | B53: Falling objects | C53: gravity | D53: Concept of Weight | E53: 0.500
D54: Weight: The external force in a free falling object | E54: 0.500
A55: Forces and Motion | B55: Falling objects | C55: kinetic energy | D55: Kinetic Energy of Ball in Free Fall | E55: 0.500
D56: Kinetic Energy in Falling Objects | E56: 0.500
A57: Forces and Motion | B57: Falling objects | C57: lift | D57: Basic Facts about Lif | E57: 0.250
D58: Factors that Affect Lift | E58: 0.250
D59: Various Aspects about lif | E59: 0.250
D60: How is Lift produced in an aircraft | E60: 0.250
A61: Forces and Motion | B61: Falling objects | C61: Newtons 1st law | D61: Newtons First Law with Example | E61: 0.200
D62: Newtons First law explaine | E62: 0.200
D63: Inertia of a bod | E63: 0.200
D64: Animation: Why are seat belts necessary | E64: 0.200
D65: Animation: Law of Inertia in the real world | E65: 0.200
A66: Forces and Motion | B66: Falling objects | C66: Newtons 2nd law | D66: F=ma relationship explaine | E66: 0.250
D67: Newtons Second Law Explained | E67: 0.250
D68: Statement of Newtons Second la | E68: 0.250
D69: Newtons Second Law in rocket | E69: 0.250
A70: Forces and Motion | B70: Falling objects | C70: potential energy | D70: Potential Energy in falling objects | E70: 0.500
D71: Gravitational Potential Energy | E71: 0.500
A72: Forces and Motion | B72: Falling objects | C72: shape | D72: Effect of Airfoil Curvature on Lift | E72: 0.500
D73: Effect of shape on dra | E73: 0.500
A74: Forces and Motion | B74: Falling objects | C74: Speed | D74: The Acceleration of Gravity | E74: 1.000
A75: Forces and Motion | B75: Falling objects | C75: Velocity | D75: Variation of velocity in Ideal Free Fall | E75: =1/3 -> 0.33333333333333331
D76: Velocity in Falling Object | E76: =1/3 -> 0.33333333333333331
D77: Terminal Velocity | E77: =1/3 -> 0.33333333333333331
A78: Forces and Motion | B78: Falling objects | C78: work | D78: The concept of Work | E78: 0.500
D79: Interactive Activity: Relationship between Work, force and displacement | E79: 0.500
A80: Forces and Motion | B80: Linear motion | C80: acceleration | D80: Motion of accelerating objects | E80: 0.500
D81: Interactive Activity: Effect of Acceleration on linear motion | E81: 0.500
A82: Forces and Motion | B82: Linear motion | C82: energy | D82: Introduction to Energy | E82: 0.500
D83: Mechanical Energy | E83: 0.500
A84: Forces and Motion | B84: Linear motion | C84: force | D84: The Normal Force | E84: 1.000
A85: Forces and Motion | B85: Linear motion | C85: friction | D85: Interactive Activity: Effect of frcition on the distance traveled | E85: 1.000
A86: Forces and Motion | B86: Linear motion | C86: kinetic energy | D86: Skidding Distance and Kinetic Energy | E86: 1.000
A87: Forces and Motion | B87: Linear motion | C87: mass | D87: Relation between mass and momentu | E87: =1/3 -> 0.33333333333333331
D88: Relation between mass and acceleration experience | E88: =1/3 -> 0.33333333333333331
D89: Mass and Kinetic Energy | E89: =1/3 -> 0.33333333333333331
A90: Forces and Motion | B90: Linear motion | C90: Newtons 1st law | D90: Newtons First Law with Example | E90: 0.200
D91: Newtons First law explaine | E91: 0.200
D92: Inertia of a bod | E92: 0.200
D93: Animation: Why are seat belts necessary | E93: 0.200
D94: Animation: Law of Inertia in the real world | E94: 0.200
A95: Forces and Motion | B95: Linear motion | C95: Speed | D95: Speed and its various kinds | E95: 1.000
A96: Forces and Motion | B96: Linear motion | C96: Velocity | D96: Basic Concepts About Velocity | E96: 0.500
D97: Calculation of velocity | E97: 0.500
A98: Forces and Motion | B98: Linear motion | C98: work | D98: Relation between force and work | E98: 0.500
D99: Interactive activity: Relation between Work, Force and Displacement | E99: 0.500
A100: Forces and Motion | B100: Rotational motion | C100: acceleration | D100: Angular Acceleration and Torque | E100: 1.000
A101: Forces and Motion | B101: Rotational motion | C101: force | D101: Introduction to Torque | E101: 0.500
D102: Torque and angular acceleration | E102: 0.500
A103: Forces and Motion | B103: Rotational motion | C103: momentum | D103: Angular Momentum | E103: 1.000
A104: Forces and Motion | B104: Rotational motion | C104: Newtons 1st law | D104: Newtons First Law with Example | E104: 0.500
D105: Newtons First law explaine | E105: 0.500
A108: Teacher:gnesdilow, Date:20070219
A110: Unit | B110: Topic | C110: Concept | D110: DL-link | E110: count
A111: Forces and Motion | B111: Falling objects | C111: Newtons 3rd law | D111: Newtons Third La | E111: 0.500
D112: Action Reaction Forces and Forces in Equilibriu | E112: 0.500
A114: Teacher:gnesdilow, Date:20070222
A116: Unit | B116: Topic | C116: Concept | D116: DL-link | E116: count
A117: Forces and Motion | B117: Circular motion | C117: force | D117: Centripetal Force | E117: 1.000
A119: Teacher:gnesdilow, Date:20070224
A121: Unit | B121: Topic | C121: Concept | D121: DL-link | E121: count
A122: N/A | B122: N/A | C122: work | D122: Work in terms of Energy | E122: 1.000
A124: Teacher:gnesdilow, Date:20070518
A126: Unit | B126: Topic | C126: Concept | D126: DL-link | E126: count
A127: Forces and Motion | B127: Circular motion | C127: acceleration | D127: Basics of Centripetal Acceleration | E127: 0.500
D128: Expression for Centripetal acceleration and force | E128: 0.500
A129: Forces and Motion | B129: Circular motion | C129: force | D129: Motion Characteristics for Circular Motion | E129: 0.400
D130: Centripetal Force and its direction | E130: 0.200
D131: Car Motion and Centripetal force | E131: 0.200
D132: Expression of centripetal force | E132: 0.200
A134: Teacher:smiley, Date:20070529
A136: Unit | B136: Topic | C136: Concept | D136: DL-link | E136: count
A137: N/A | B137: N/A | C137: acceleration | D137: Acceleration: An introduction | E137: 1.000
A138: Forces and Motion | B138: Circular motion | C138: acceleration | D138: Acceleration in Circular Motion | E138: 1.000
A139: Forces and Motion | B139: Circular motion | C139: force | D139: Centripetal Force and its direction | E139: 1.000
A140: Forces and Motion | B140: Circular motion | C140: G forces | D140: G Forces in a roller coaster loop | E140: 1.000
A141: Forces and Motion | B141: Circular motion | C141: gravity | D141: Weightlessness | E141: 1.000
A142: Forces and Motion | B142: Circular motion | C142: Newtons 3rd law | D142: Newtons Third Law | E142: 1.000
A143: Forces and Motion | B143: Falling objects | C143: N/A | D143: Introduction to Free Fall | E143: 1.000
A144: Forces and Motion | B144: Falling objects | C144: acceleration | D144: Interactive Activity: Free Fall Simulation | E144: 0.250
D145: Acceleration during Free Fall: Ideal Condition | E145: 0.250
D146: Acceleration during Free Fall: Real world | E146: 0.250
D147: Calculation of Velocity and Distance traveled using 'g' | E147: 0.250
A148: Forces and Motion | B148: Falling objects | C148: force | D148: Lift and Drag | E148: 1.000
A149: Forces and Motion | B149: Falling objects | C149: gravity | D149: Concept of Weight | E149: 0.800
D150: Weight: The external force in a free falling object | E150: 0.200
A151: Forces and Motion | B151: Falling objects | C151: mass | D151: Effect of mass on the motion of an object in free fall | E151: 1.000
A152: Forces and Motion | B152: Falling objects | C152: Newtons 3rd law | D152: Action Reaction Forces and Forces in Equilibrium | E152: 0.500
D153: Newtons Third Law in Nature | E153: 0.500
A154: Forces and Motion | B154: Falling objects | C154: potential energy | D154: Potential Energy in falling objects | E154: 0.800
D155: Gravitational Potential Energy | E155: 0.200
A156: Forces and Motion | B156: Falling objects | C156: shape | D156: Effect of shape on draw | E156: 0.800
D157: Effect of Airfoil Curvature on Lift | E157: 0.200
A158: Forces and Motion | B158: Linear motion | C158: friction | D158: Interactive Activity:Damping Effect of Friction on motion | E158: =6/11 -> 0.54545454545454541
D159: Interactive Activity:Relation between Mass and Friction | E159: =3/11 -> 0.27272727272727271
D160: Interactive Activity: Effect of frcition on the distance traveled | E160: =2/11 -> 0.18181818181818182
A161: Forces and Motion | B161: Rotational motion | C161: acceleration | D161: Angular Acceleration and Torque | E161: 1.000
A162: Forces and Motion | B162: Rotational motion | C162: momentum | D162: Angular Momentum | E162: 1.000
A163: Forces and Motion | B163: Rotational motion | C163: Newtons 1st law | D163: Newtons First Law with Examples | E163: 0.500
D164: Inertia of a body | E164: 0.500
A166: Teacher:smiley, Date:20070530
A168: Unit | B168: Topic | C168: Concept | D168: DL-link | E168: count
A169: N/A | B169: N/A | C169: acceleration | D169: Acceleration: An introduction | E169: =2/3 -> 0.66666666666666663
D170: Direction of Acceleration | E170: =1/3 -> 0.33333333333333331
A171: Forces and Motion | B171: Circular motion | C171: Newtons 3rd law | D171: Action Reaction Forces and Forces in Equilibrium | E171: =1/3 -> 0.33333333333333331
D172: Newtons Third Law | E172: =1/3 -> 0.33333333333333331
D173: Newtons Third Law in Nature | E173: =1/3 -> 0.33333333333333331
A174: Forces and Motion | B174: Falling objects | C174: N/A | D174: Introduction to Free Fall | E174: 1.000
A175: Forces and Motion | B175: Falling objects | C175: acceleration | D175: Acceleration during Free Fall: Ideal Condition | E175: 0.500
D176: Acceleration during Free Fall: Real world | E176: 0.500
A177: Forces and Motion | B177: Falling objects | C177: drag | D177: Motion of a falling objects when drag is present | E177: =1/6 -> 0.16666666666666666
D178: Free Fall and Air Resistance | E178: =1/6 -> 0.16666666666666666
D179: Effect of Surface Area and speed on the motion of free falling objects | E179: =1/6 -> 0.16666666666666666
D180: Free fall of an elephant and a feather | E180: =1/6 -> 0.16666666666666666
D181: Factors affecting Drag | E181: =1/6 -> 0.16666666666666666
D182: Kinds of Drag | E182: =1/6 -> 0.16666666666666666
A183: Forces and Motion | B183: Falling objects | C183: gravity | D183: Weight: The external force in a free falling object | E183: 0.500
D184: Concept of Weight | E184: 0.500
A185: Forces and Motion | B185: Falling objects | C185: lift | D185: Factors that Affect Lift | E185: 1.000
A186: Forces and Motion | B186: Falling objects | C186: mass | D186: Effect of mass on the motion of an object in free fall | E186: 1.000
A187: Forces and Motion | B187: Falling objects | C187: Newtons 3rd law | D187: Newtons Third Law | E187: 0.500
D188: Action Reaction Forces and Forces in Equilibrium | E188: 0.500
A189: Forces and Motion | B189: Falling objects | C189: shape | D189: Effect of shape on draw | E189: 1.000
A190: Forces and Motion | B190: Falling objects | C190: Speed | D190: The Acceleration of Gravity | E190: 1.000
A191: Forces and Motion | B191: Linear motion | C191: N/A | D191: Interactive Activity: Velocity and Acceleration in Linear Motion | E191: 0.500
D192: Introduction to the concept of Delta | E192: 0.500
A193: Forces and Motion | B193: Linear motion | C193: acceleration | D193: Motion of accelerating objects | E193: 0.500
D194: Interactive Activity: Effect of Acceleration on linear motions | E194: 0.500
A195: Forces and Motion | B195: Linear motion | C195: friction | D195: Interactive Activity: Effect of frcition on the distance traveled | E195: 0.500
D196: Interactive Activity:Damping Effect of Friction on motion | E196: 0.250
D197: Interactive Activity:Relation between Mass and Friction | E197: 0.250
A198: Forces and Motion | B198: Linear motion | C198: kinetic energy | D198: Skidding Distance and Kinetic Energy | E198: 1.000
A199: Forces and Motion | B199: Linear motion | C199: Speed | D199: Speed and its various kinds | E199: 1.000